<?xml version="1.0"?>
<dataDocument xmlns:xsi="http://www.w3.org/2001/XMLSchema-instance" xsi:schemaLocation="example-26.xsd example-26.xsd">
    <engineType>
        <engineDetail>
            <combustible>Petrol</combustible>
        </engineDetail>
        <fuelDetail>
            <combustible>Diesel</combustible>
        </fuelDetail>
        <capacityDetail>
            <capacityUnit>Gallon</capacityUnit>
        </capacityDetail>
    </engineType>
</dataDocument>